{
  "$schema": "https://json-schema.org/draft/2020-12/schema",
  "type": "object",
  "properties": {
    "schema_version": {
      "const": "1.0.0"
    },
    "table_version": {
      "type": "string",
      "minLength": 1
    },
    "authority": {
      "type": "string",
      "minLength": 1
    },
    "license": {
      "type": "string",
      "minLength": 1
    },
    "entries": {
      "type": "object",
      "properties": {
        "Cf": {
          "type": "array",
          "items": {
            "type": "array",
            "prefixItems": [
              {
                "type": "integer",
                "minimum": 0
              },
              {
                "type": "integer",
                "minimum": 0
              }
            ],
            "minItems": 2,
            "maxItems": 2
          }
        },
        "Cc": {
          "type": "array",
          "items": {
            "type": "array",
            "prefixItems": [
              {
                "type": "integer",
                "minimum": 0
              },
              {
                "type": "integer",
                "minimum": 0
              }
            ],
            "minItems": 2,
            "maxItems": 2
          }
        },
        "Default_Ignorable_Code_Point": {
          "type": "array",
          "items": {
            "type": "array",
            "prefixItems": [
              {
                "type": "integer",
                "minimum": 0
              },
              {
                "type": "integer",
                "minimum": 0
              }
            ],
            "minItems": 2,
            "maxItems": 2
          }
        },
        "Extended_Pictographic": {
          "type": "array",
          "items": {
            "type": "array",
            "prefixItems": [
              {
                "type": "integer",
                "minimum": 0
              },
              {
                "type": "integer",
                "minimum": 0
              }
            ],
            "minItems": 2,
            "maxItems": 2
          }
        },
        "Emoji_Modifier": {
          "type": "array",
          "items": {
            "type": "array",
            "prefixItems": [
              {
                "type": "integer",
                "minimum": 0
              },
              {
                "type": "integer",
                "minimum": 0
              }
            ],
            "minItems": 2,
            "maxItems": 2
          }
        }
      },
      "required": [
        "Cf",
        "Cc",
        "Default_Ignorable_Code_Point",
        "Extended_Pictographic",
        "Emoji_Modifier"
      ],
      "additionalProperties": false
    }
  },
  "required": [
    "schema_version",
    "table_version",
    "authority",
    "license",
    "entries"
  ],
  "additionalProperties": false
}
